Package name,Reviewer name,Review,Rating
workout.progression.lite,A Google user,"I have tried other exercise apps, but this one is fully featured and works well with my Moto 360 watch. Easy to use, easy to share results.",5
workout.progression.lite,A Google user,Took me a minute to understand the UI but after a few minutes of poking around this is one of the best weightlifting apps I've ever used. UI is modern and clean. Google Fit integration is A+. The only knock on this is that i can't figure out how to make the rest countdown audible. would help when my phone is not in my pocket.,5
workout.progression.lite,A Google user,Does what is needed with a nice eye-catching look.,5
workout.progression.lite,A Google user,And that masterful material design just makes it that much better and easier to use.,5
workout.progression.lite,A Google user,"The best app ever, very great job! If you can connect app with google(and some adjustments), app will become perfectly perfect! Shared it on Facebook :)",5
workout.progression.lite,A Google user,Awesome,5
workout.progression.lite,A Google user,Overall a good app. Timer skips numbers as it counts down and also believes 80 seconds is a minute and 30 seconds,4
workout.progression.lite,A Google user,"Was very out of practice with working out in a gym environment as I hadn't been in about 10 years. After trialling many apps found this one to stand out both from a visual, functional and stability point of view. Well worth the money!",5
workout.progression.lite,A Google user,"However, is there any way to add a past workout to the calendar? Sometimes I don't bring my phone to the gym so I can't track with this app, but I'd still like to add it in to see which body parts I've worked. Thanks!",5
workout.progression.lite,A Google user,Hows allowed me to keep great statistics on my gym sessions,5
workout.progression.lite,A Google user,"This is an awesome workout app. It, almost, has everything I need. There should be more specific muscle groups, ie. quads, hamstrings, glutes, instead of just legs. Also, an easier way to export the data, including the entire workout, would be great. I purchased this app so that I could export the CSV, and all it was was a worksheet of the length of time, calories burned, total weight lifted etc. Id like to export the entire workouts, including the exercises, reps, and weights into a worksheet. Then, I can give 5 stars",4
workout.progression.lite,A Google user,It looks like a great app but it was missing a lot of cardio based exercises like jumping jacks and running in place.  Looks great for body building but not for high cardio weight loss.,3
workout.progression.lite,A Google user,"The UI is great, and it feels really intuitive to use. However, 2 things, it'd be great if there were a desktop site. Additionally, is there a way to add body weight stats? Currently it calculates calories burned, but of course this cannot be accurate without my weight. 5 stars due when these are implemented! :)",4
workout.progression.lite,A Google user,"I have been looking for an app to track body-weight super-set circuits and this is close, but there is no way to set up something like ""a continuous circuit of 15x mountain climbers, 15x burpees, 15x situps for 5 min"" and track how many full circuits I get through. I can at least visually group them to remind myself what's next, so it's a good start. Adding timing, circuit reps, and better configuration to groups would be a huge step!",3
workout.progression.lite,A Google user,"Tried several apps before finding this. Easy to log while working out, pretty intuitive. 2 enhancements to make it perfect:  an option to disable the floating rest timer, and the ability to put notes on an exercise (not just a set). Really like it!  EDIT: Developer is responsive and implemented the changed I'd mentioned. Tried another app in the meantime but have now come back to this one again - other interfaces just can't compare!",5
workout.progression.lite,A Google user,"I absolutely love this app. I've learned new moves, gotten into better shape, and had fun with it, plus it's easy to use and full of features. I'd love some way to back up my history, though: when my phone died I lost that because it was stored locally.",4
workout.progression.lite,A Google user,"I'm really impressed by the clean, material design.   If you are going for a simple, clean workout tracker, this is the one. Great features, including the ability to add exercises, timers, commenting on sets and build really customized workouts and sets. Absolutely fantastic!",5
workout.progression.lite,A Google user,"After syncing to Dropbox, I've lost my current workout :(",3
workout.progression.lite,A Google user,"Great app, this is the perfect way to continue to motivate yourself and strive to improve your body and life, please continue to make more updates for this, I for one will not stop using it by far the best workout app and I've used over 10 lol",5
workout.progression.lite,A Google user,"Hands down, the best fitness app available for Android till the date",5
workout.progression.lite,A Google user,Would be great to determine if you've beaten your personal best based on your previous results. There's really no prompt to tell you that you've improved. Other than that this is an excellent workout app,4
workout.progression.lite,A Google user,"Easily the best workout app I've ever tried, and I've tried a lot of them. I design mobile games for a living and was pleasantly surprised by this app's attention to detail in UX. Some small quibbles, but nothing major.",5
workout.progression.lite,A Google user,"The dev is fantastic and is very responsive on G+ and email. Since I first installed Progression it's grown/changed so much, all for the better. This is 100 percent a five star app.",5
workout.progression.lite,A Google user,"Tried a few workout apps like Fitnotes, Jefit, etc. But Progression is the best! Seamless integration with Google Fit and beautiful material design!",5
workout.progression.lite,A Google user,It would be great if there is also support for myfitnesspal and runkeeper.,4
workout.progression.lite,A Google user,"This is a great app, I love the plate loading calculation feature and the statistics.. And the Google Fit integration is awesome.  It would be nice if I could export a custom built workout schedule (only) and share with a buddy who also uses this app.",4
workout.progression.lite,A Google user,"Really great app, can't believe I wasted so much time with others. Bought the pro upgrade, and the statistics/history is extremely helpful. One suggestion: add stretches!",5
workout.progression.lite,A Google user,"I've been looking for something like this for a while, very clean interface and super customisable - it's great.  Little bit confusing at first in terms of getting circuits set up but once I figured it out it works well.  The only thing I'd like to be able to do is manually start the timer for the next set, rather than it happening automatically as it confuses stats if you don't manage to start your set on time.",5
workout.progression.lite,A Google user,"Great app,  thank you! One question, How to change time in stopwatch?",5
workout.progression.lite,A Google user,"This is a great app but it desperately needs more workouts for those who pay for the pro version as well as the ability to back up/sync to google drive not just Dropbox. The feature for syncing with google fit is awesome, thanks!",4
workout.progression.lite,A Google user,Has a nice design and seems to have all the features I could ever need (at least in the setup process). Looking forward to testing it out in the gym and buying the unlocker if it is as good as I think it will be.,5
workout.progression.lite,A Google user,برنامه های تمرینی متنوع. تصاویر و متن آموزشی مفید برای هر حرکت. امکان مشاهده ی روند پیشرفت در نسخه پولی.,5
workout.progression.lite,A Google user,Has alot to offer,4
workout.progression.lite,A Google user,"I love this app and bought it to unlock all features. I've been using it since Monday this week and set it up beforehand, and I have to say it's really good. A few notes, though: What is the point of being forced to insert the amount of reps on an all-out (failure) set? And is there an easier way to set up a circuit within a training schedule for a specific day? Asking since I'm doing my ab workouts in circuits and it's a little messy to go back and forth between different exercises and sets. Thanks!",5
workout.progression.lite,A Google user,I have tried a few different gym logs this is by far the best I love it's ease of use and reliability due to get a smart watch soon can't wait to try it on that my only slight gripe is I can't see a way to  lower my music volume when the timer sounds which means I need to watch the timer currently smart watch should solve that issue though but great app well done,5
workout.progression.lite,A Google user,Been using this app for the last 2 weeks and love it.  Only missing component would be more tools to analyze my workouts and progress,4
workout.progression.lite,A Google user,So far for me the only glitch is that I can't seem to edit exercises for a workout after I have completed it. I forgot to add an exercise and I have saved few sets with wrong weight - please make it possible to edit...,4
workout.progression.lite,A Google user,This is one of the best fitness apps.,5
workout.progression.lite,A Google user,I just started a few different dance aerobic workouts and was disappointed to see dance not listed.,2
workout.progression.lite,A Google user,Best tracker out there and it's worth buying the pro version,5
workout.progression.lite,A Google user,Love the app!!! Great job guys! One thing I'd like to see is integration with my fitness pal :),4
workout.progression.lite,A Google user,"Found this via Reddit and I am over the moon with it. Unfortunately haven't used on my watch as I want to get a silicone band first but have no doubt it will work as effortlessly as the phone app. The summary in particular is fantastic, Well done on all aspects!",5
workout.progression.lite,A Google user,Nic,5
workout.progression.lite,A Google user,It helped me to become fitter than I was expecting. This app really helped me.,5
workout.progression.lite,A Google user,"This is the best gym app I've ever used, I no longer need to get my phone out of my pocket as I can track my weight, reps and easily move onto each exercise in my workout from my android wear device. Good work guys, the only wish I have is that you include a rower in the cardio section as I use that to warm up, otherwise an excellent and clean, modern looking app that kicks the snot out of JEFIT (they still have no wear feature). Well done.",5
workout.progression.lite,A Google user,"I have tried many apps for tracking workouts and this is one of the best. I would give 5 stars but I have a couple questions. Why can't I add multiple of the same exercise to a workout? This is especially useful to me for cardio. And why if I have multiple cardio exercises in a workout can't I change the durations to be different? Say I have treadmill and elliptical in the same workout, if I change the duration of one it automatically changes it on the other. Other than that I like it so far.",4
workout.progression.lite,A Google user,"Fantastic App - As I normally do slightly different work outs on different days of the week the 'workout now' option is perfect.  One issue I do have, every time I use this app it turns the volume of my alarm to full. Therefore, the next morning I get a bit of a shock when my alarm goes off. I am using a One Plus One.",5
workout.progression.lite,A Google user,"This is a fantastic app that's for sure but I'm just a starter, I need some basic exercises and a schedule to build my body strong. If there is any schedule in this app. That will help me a lot",4
workout.progression.lite,A Google user,"The timer is very helpful on keeping your workout momentum going and keeping you on task. The diagrams are useful for beginners and showing which muscles each exercise works is helpful when making your own workout. Also the no ads is very, very nice.",5
workout.progression.lite,A Google user,"It gets so many things right, inserting the data is almost a pleasure. With other apps I tried I had to adapt to how they wanted the data input or use workarounds to do what I wanted, with this one it works exactly as I'd like it to. Some improvements: * it should be possible to put the same exercise multiple times in a workout / schedule  * it should be possible to change an exercise of a past workout, or add/remove one.",5
workout.progression.lite,A Google user,Relly works...,5
workout.progression.lite,A Google user,I hate it cos all it does is spin in a spiral when it  should be showing the exercise I did,1
workout.progression.lite,A Google user,Will be great to add the option to add additional series for the treadmill running. Sometime you may have mora than 1 serie and the app doesn't let you add the same exercise twice. Thank you and great job!,4
workout.progression.lite,A Google user,Requests unnecessary permissions (access external storage). App should use its private data directory instead.,1
workout.progression.lite,A Google user,"I like how this app letting you to customise your own exercise but it would be nicer to add more moves into it and also some warming up move like jumping jacks, burpees, & so on. 😉😉 PS. Thanks for the reply Zoltant Demand! I noticed that feature but somehow I can't set the set and reps for customised exercise :(",4
workout.progression.lite,A Google user,Did not use it much,3
workout.progression.lite,A Google user,"Love this app, so useful for use with android wear. Only wish I could start the app without using my phone so I don't need my phone with me all the time.",3
workout.progression.lite,A Google user,"I built a 3-day schedule, and right after I was done, it reset back to the defaults. Please look into it, thx",3
workout.progression.lite,A Google user,Great app for tracking workouts. But the import/export is a little wonky,3
workout.progression.lite,A Google user,This is exactly what I was looking for.,5
workout.progression.lite,A Google user,Fantastic! Be perfect if it used new Android app backup also.,5
workout.progression.lite,A Google user,"I usually don't rate apps unless they're horrible or astounding. This one is the later. It's amazing, and Android Wear support is GREAT. It has helped me exercise better...",5
workout.progression.lite,A Google user,The best,5
workout.progression.lite,A Google user,This is all I need! Interesting and not so complicated to understand. Thank you to the developer who made this amazing apps. Good Job! 👌😁😁,5
workout.progression.lite,A Google user,"Very well put together and polished app. The developer is responsive, both to questions as well as to the changing hardware/OS environment. I used this app for a grand total of 5 days before realizing that the $5 investment for the full app is 100% worth it. I should note that the free features are more than sufficient but the extra analysis features are worth the upgrade",5
workout.progression.lite,A Google user,Gym,5
workout.progression.lite,A Google user,Great job! Used it once and purchased upgrade. Having trouble with Dropbox sync. Hopefully now with Android 6 marshmallow it will automatically backup to Google servers.,5
workout.progression.lite,A Google user,"Material design, Google fit integration, Android Wear support. This app has it all",5
workout.progression.lite,A Google user,Hoping to get my muscles and a good body shape after some months of workout,4
workout.progression.lite,A Google user,Nic app,2
workout.progression.lite,A Google user,I loved this kind of app,5
workout.progression.lite,A Google user,Just what i needed,5
workout.progression.lite,A Google user,"The app has a wonderful cohesive look, and is very easy to pick up and use.",5
workout.progression.lite,A Google user,"very nice app , it useful app",5
workout.progression.lite,A Google user,Ok! found it.. Didn't realize the scrolling in the list. Now.. Have you thought about adding a timer or even better an interval timer to the app? Then I can uninstall everything but progression.. It will be the perfect fitness app period.,5
workout.progression.lite,A Google user,"Totally awesome., Great job devs! Plsssss don't ruin it in the future with crazy design updates., Keep it this way it's simply amazing!",5
workout.progression.lite,A Google user,This is what I was looking for... All-in-one.. Plate calculator that was the thing I was looking for. Thank you developer.. Keep developing apps like this🙌,5
workout.progression.lite,A Google user,Its an awesome app i loved it thanks for such a wonderful and helpful app,5
workout.progression.lite,A Google user,Im surprised this isn't on the top fitness apps out there this is totally worth a 5 star simple and solid,5
workout.progression.lite,A Google user,"It has all the features i need in a clean and simple design. Every other workout log app in the market has good ideas, but all of 'em so far, in my opinion either keeps the user staring at a phone screen at the gym constantly, or have some kind of design or performance issue. I honestly went back to using pen and paper,until now. Somehow, this app just clicked for me. After a couple of times using it, i already knew where everything was. Thank you so much, and congrats for the fantastic app.",5
workout.progression.lite,A Google user,"Just simply, clean and useful!",5
workout.progression.lite,A Google user,Great,4
workout.progression.lite,A Google user,Love dis app,5
workout.progression.lite,A Google user,I love it and use it daily. I think the only thing missing for me is workout pausing. Cheers!,5
workout.progression.lite,A Google user,Very very good App,5
workout.progression.lite,A Google user,Fitness? Material design? Attentive developer? What more can you ask for? Sold!,5
workout.progression.lite,A Google user,"Great Dev, I contacted the developer due to some changes made to the app & some concerns I had. Developer answered quickly & even more amazing he quickly fixed the issue with the resting alarm.   I was already a convert before & after his quick communication & even quicker fix, I give this app 5 stars. If you're serious about your workout, this is the app to get!",5
workout.progression.lite,A Google user,"I love it! It's simple to use, it has everything I need and more. I especially love the plate calculator, and the used weight tracker from the last workout.",5
workout.progression.lite,A Google user,Kadak,5
workout.progression.lite,A Google user,It works successfully as an instructor to keep fitness..thank you,5
workout.progression.lite,A Google user,"I've been tracking my lifting routines for a year using Fit Notes because it was the only app that had all the features I needed. This app not only does everything Fit Notes does plus a bunch of extra features, but with material design to boot! It even replaced my plate calculator app by including one while you work out! All it's missing is calculations for things like 5/3/1 weight percentages. If you lift, don't even bother using a different app, just download this one.",5
workout.progression.lite,A Google user,Gooooood,4
workout.progression.lite,A Google user,Works great,1
workout.progression.lite,A Google user,I think I will love it,5
workout.progression.lite,A Google user,Simply too gud keep it up,5
workout.progression.lite,A Google user,awsome,5
workout.progression.lite,A Google user,Good app,4
workout.progression.lite,A Google user,App,5
workout.progression.lite,A Google user,My weights are in lbs not kg... Couldn't find a way to change to lbs.,2
workout.progression.lite,A Google user,awesome,5
workout.progression.lite,A Google user,"Great Work, Thanks Whole Team.",5
workout.progression.lite,A Google user,Fghu,3
workout.progression.lite,A Google user,Like it,5
workout.progression.lite,A Google user,Talha,1
workout.progression.lite,A Google user,Kgschuuhcxb,5
workout.progression.lite,A Google user,Love it..,5
workout.progression.lite,A Google user,Eat to healthy,3
workout.progression.lite,A Google user,Good app,5
workout.progression.lite,A Google user,Got confused.  😕,3
workout.progression.lite,A Google user,Best tracker I tried,5
workout.progression.lite,A Google user,"My favourite workout app. I've tried several, but this one is the best. I've  been using it every day for several months. If I could add anything to make it even better: include a feature for warm-up sets! And possibly a weight calculator for drop-sets (ie, you punch in set 2 as -10% of set 1, it calculates what that is for you, rounded to the plates you have available. I know it's fairly simple math, but I can't always think straight during a workout). Thanks for the app!",5
workout.progression.lite,A Google user,"This is the best workout tracking app I've used and I've tried a bunch of them. It's snappy, versatile, looks good and doesn't get in the way when I'm working out. The rest timer is fantastic and the integration into Google Fit is a welcome bonus. Keep it up.",5
workout.progression.lite,A Google user,It would be great to have fitness ball exercises and stretches.,5
workout.progression.lite,A Google user,Will files be visible in my Dropbox from progression? Manually pressing sync in Dropbox does nothing,4
workout.progression.lite,A Google user,It does exactly what it's needed to do. Great design too....Keep up the good work 👍,5
workout.progression.lite,A Google user,"Great app, clean and intuitive design. Love the built-in workouts and the ability to customise and create your own. The Google Fit syncing is awesome. Highly recommended!",5
workout.progression.lite,A Google user,Cardio,4
workout.progression.lite,A Google user,"I tried several workout tracker apps, including those listed as 'top picks' in online listings. This app is FAR better than any of those.",5
workout.progression.lite,A Google user,"App is crashing badly after recent updates, as soon as any ""exercise"" is opened.",3
workout.progression.lite,A Google user,I have been looking for an app for forever that is exactly like this. Looked so much that I was learning to code just to make an app similar to this. ! thanks so much. I'm sure it will come with habit but having to click two different buttons to finish a work out was confusing and I often forget to fully finish the workout.  fantastic app. thanks,5
workout.progression.lite,A Google user,I'm very much enjoying this app. It's simple intuitive and fun to use. The only thing I would suggest for an improvement is the ability to favorite exercises and view progress of those lifts only.,4
workout.progression.lite,A Google user,Works great at what it is.,5
workout.progression.lite,A Google user,"Bought the pro version for $5. Great app, does exactly what I want.  Missing a few obvious features though, like being able to add forearm exercises.  Most everything else seems to be in order.  Definitely recommend it.  *edit* - Within hours of submitting the request for custom forearm exercises, Zoltan replied informing me that they'll be included in the next update.  Awesome dev!  Very happy to support this app.",5
workout.progression.lite,A Google user,All the features you want and need in a great material design.,5
workout.progression.lite,A Google user,"Hi Zoltan, I'm  excited to use this app. However, any reason why the madcow schedule doesn't  include  the ramp up sets? On another note, if I added the ramped up sets manually, does it automatically calculate the sets for the next week's  workout?",5
workout.progression.lite,A Google user,"The material design is great! I tried to use another app, but this one has tons of workouts built in and the ability to customize them or create your own from scratch! Keep up the great work!",5
workout.progression.lite,A Google user,Would love to see more curated workout routines or an easier way to get routines from the community of users.,5
workout.progression.lite,A Google user,"Best weight lifting app out there. Simple, clean interface and customizable.",5
workout.progression.lite,A Google user,Love the integration with Google fit/drive. Also love the floating rest counter.-- downgraded to 3 Android wear part is not working on moto360 2nd gen,3
workout.progression.lite,A Google user,"Really nice Material interface, well designed, and tons of functionality even for a free app. It's very flexible and customizable and does a great job letting you build new exercises and routines. Also has nice animated diagrams for a lot of exercises which makes it look a lot more polished than apps that just embed a crappy YouTube video.",5
workout.progression.lite,A Google user,"The best app for tracking your lifting progress! Clean UI, powerful analytic functions and an awesome developer who takes his time to answer questions!",5
workout.progression.lite,A Google user,"This is great!  I honestly believe the website when it says it's ""made by weightlifters for weightlifters"".  The developer has really put some time and effort into the design and thought behind this.  Love the extra little details such as being able to comment on every set or denote a set as a warm-up or drop set, all done intuitively with ease.  My only niggle would be to add Google Drive support and other cloud storage, recently wiped my phone to upgrade software and lost my previous work-out details (i'm not a drop-box user)",5
workout.progression.lite,A Google user,"... If the creators have a cardio progression option for treadmills, cross trainers, rowing machines etc! Then the app would be complete!",5
