Package name,Reviewer name,Review,Rating
workout.progression.lite,Richard Waeteraere,Burpees not available in the app. Burpees are a very popular exercise. Weird that there are 20 different squat variations but burpees are not possible.,1
workout.progression.lite,Gregory Baran,Comprehensive list of excercises. Would be 5 stars with the ability to add your own excercises on the pro version.,4
workout.progression.lite,Johann Botha,"Bought the app because I liked the no-fuss approach. Since then, my complete workouts and history have been deleted twice in the last 3 weeks. I was also under the impression that I was syncing to Google Drive, but I can't find anything in my drive that even remotely appears to be Progression data",1
workout.progression.lite,Thiago Camargo,"Best app out there, I love it",5
workout.progression.lite,Pedro Teixeira,Really good. Love the simple interface and included plans and famous plans. Wondering if the calory counting is actually taking into account the weights etc. But really good so far.,4
workout.progression.lite,Micah Larson,Rest timer doesn't display and gogle drive syncing doesn't update,2
workout.progression.lite,Beef Cake,Used it for years now. Customized many WO. Awesome app.,5
workout.progression.lite,Marc Lehman,Perfect! I've been using it consistently for 5 years now! It was and continues to be a life changer. It helped me form a consistent workout schedule that I actually stick to. I couldn't be happier with an app.,5
workout.progression.lite,DIVINE AMAR,Potential good app.. Integrate with Google fit app is good.. But boring interface.. And worst is no voice during workout.. Only vibration.. Will be good if integrates with google voice too,2
workout.progression.lite,A Google user,This app is awesome but I hope they add some things in the future. If there was the option to add muscle groups to be more specific and the option to delete the existing exercises it would be the best fitness app. But until then I will just stick with my excel sheet.,4
workout.progression.lite,A Google user,Love it!,5
workout.progression.lite,A Google user,"Work schedules randomly disappeared and now I've lost all my history. I love this app, but I suspect that there's a sudden issue with GDrive sync and as far as I can tell this app isn't being maintained anymore, sadly.",1
workout.progression.lite,A Google user,great functionality with elegant UI. will dark mode be available soon?,5
workout.progression.lite,A Google user,The most complete training app I've ever come across. Couldn't recommend more highly,5
workout.progression.lite,A Google user,"Thanks Zoltan for pointing to the reddit thread where I can see the app is still being worked on, just that it's not yet ready to be release in the Play Store. Rating bumped back up to 5 stars.",5
workout.progression.lite,A Google user,"I've been a fitness buff for decades. Just used this app for the first time. It has room for improvement of course, but it's incredibly amazing in many other way. Needs more bodyweight cardio exercises. Love how it has a shortcut that takes me right to my music player. Immediately syncs to Google Fit after your workout. Totally customizable workouts and fitness schedules. This is definitely a tinkerers delight.",4
workout.progression.lite,A Google user,"Sync is not working, I cannot get my old workouts back after connecting to Google drive.",1
workout.progression.lite,A Google user,I have been using this app for 3 years and I couldn't be happier. It's so simple to use and allows customization. I love it!,5
workout.progression.lite,A Google user,Really great app for tracking workouts I've been using it for a good few years now. The only tiny niggle I have is that for cardio exercises like cycling and rowing seconds are not recorded which is frustrating when you are trying to improve your time. Also multiple sessions of say rowing are not allowed in one workout. Tiny niggles though,5
workout.progression.lite,A Google user,"Hands down the best fitness app around. No really. Some UI patterns were a bit confusing to learn, but after actually using it, you'll realise how powerful it is. It's feature complete, really. Wish it'll never go away. But I made a backup of the app just to be sure.",5
workout.progression.lite,A Google user,The images are not downloading doe the workouts. I just paid for Pro as an incentive to fix it :),3
workout.progression.lite,A Google user,Love the app. Been using the app for 3/4 year now and have had absolutely no issues 👌,5
workout.progression.lite,A Google user,Im really enjoying the app and have made great progress since using it. The only addition I would really like to see is a way to go to the next set from the lock screen. Unlocking my phone so frequently is inconvenient. Besides that small inconvenience the app is every you would want.,4
workout.progression.lite,A Google user,Great app and simple to use. Very responsive developer. Progression Body & weight log is by him as well and is worth it. Everything syncs well together and it has Google fit and Google drive sync.,5
workout.progression.lite,A Google user,I couldn't figure out how to modify weight in the sets.,1
workout.progression.lite,A Google user,"Despite being outdated and apparently dead (last release 2017), this is a great app, works wonders, easy to use, super configurable and best of all it syncs with google fit perfectly unlike other apps that are a hit and miss.",5
workout.progression.lite,A Google user,"The images just stopped downloading on Samsung Galaxy S9. I tried reinstalling, clearing cache, etc. The images don't download no matter what.",2
workout.progression.lite,A Google user,Been using this app for many years and it is unbeatable the best one for gym workouts tracking.,5
workout.progression.lite,A Google user,Updating my review: tried to look for your wear OS app on my smart watch. Couldn't find it. What happened?,5
workout.progression.lite,A Google user,"Good app, convenient and flexible. Has most exercises I use and you can add excersices pretty easily. It is not getting 5 stars only because I can't choose the default schedule and it don't open the last training I used.",4
workout.progression.lite,A Google user,"Been using it for nearly two years, best app to help me track my progress and beat it each time 10/10",5
workout.progression.lite,A Google user,Great app. Would be fantastic if I could create a workout and then share to my friends.,5
workout.progression.lite,A Google user,Great app. Simple effective and have been using it for years. Will never look elsewhere,5
workout.progression.lite,A Google user,"The best: perfect app: perfect support: and upcoming features are insane. Very good support forum with developers that listen to it's customers. Way better than , strong / fitnotes / jefit / etc etc...",5
workout.progression.lite,A Google user,"Tried 3 other apps before sticking with this one for close to 3 years now. Great tracker, excellent syncing between devices and phenomenal help from developer when needed!",5
workout.progression.lite,A Google user,"I've only used the app once, but so far I'm liking it a lot! I use a Google wear watch, so having it compatible with that is amazing. There are a few things though that I really wish this app did. The main thing is I wish that the app would allow me to share my workout schedule with a friend so they can use the same schedule, not just export your workout data. Another small thing would be to take in account your heartrate and bodyweight for calories burned. Overall pretty decent",4
workout.progression.lite,A Google user,"Mostly works smoothly and looks good. Would prefer if the rest timer was in app instead of a notification. Real issue, it absolutely will not let you skip a set/workout. Something tweaked in my hip on my 2nd squat set but it won't let me enter 0 reps for the third scheduled squatting set, and won't let me move on to the next workout on the plan. Really defeats the entire purpose of a workout tracker if you can't track what happens or have to fabricate sets. Hope that gets fixed.",4
workout.progression.lite,A Google user,"Overall a very good app. It's easy to navigate and use, has a good interface, and supports backups on drive, which is convenient. I haven't encountered any issues/bugs in >1 year of using it. Since you can setup your own workout schedule, it's useable with most programs. One small downside is that there's no support for percentage-based weight progression, so if you're doing 5/3/1 or something similar you'd have to calculate the weights somewhere else.",5
workout.progression.lite,A Google user,Impossible to download exercise images,2
workout.progression.lite,A Google user,"Simple interface, no fluff, minimal interaction needed throughout your workout, really well done.",5
workout.progression.lite,A Google user,Hello. I have upgraded and the amount has also been deducted from the account. But still it's telling me to upgrade. Guide me.,4
workout.progression.lite,A Google user,"Awesome app, been using for several years now. Only thing I would like to see added is the ability to assign a specific sound for the set timer. Otherwise awesome",5
workout.progression.lite,A Google user,"Very good app, simple and effective",5
workout.progression.lite,A Google user,"Great app, simple and clutter free. But hasn't been updated in a long time and it shows. For example, the drop-down in the comment pop-up goes all the way down to the (gesture) nav bar, and it's difficult to select the last item called 'warmup'.",4
workout.progression.lite,A Google user,My friend recommended this app to me about 3 years ago and I've been using it since. I have tried to use other apps in the past but they're just complicated and confusing. I recently switched over to an iPhone and it isn't available in the App Store. Are there any plans on releasing the app for the iPhone users in the future? I carry two phones to the gym just so that I can track my workouts using this app. It would be awesome if there was an iOS version of it.,5
workout.progression.lite,A Google user,I like the app a lot but recently exercise images no longer show up in the app,5
workout.progression.lite,A Google user,"Best app I've used for working out, just missing the option to share my workout schedule with friends, so they don't have to manually copy the workout.",4
workout.progression.lite,A Google user,This app was awesome until a recent Android update which causes frequent crashing and renders the app almost non-functional. Hopefully Zoltan can pinpoint the issue and update.,4
workout.progression.lite,A Google user,Great!,5
workout.progression.lite,A Google user,"And one more star for the app being able to work with my smartwatch, again! One more star for the developer answering to me ;-)... Semplicemente la migliore app perché con un solo acquisto hai le schede dei workout, ognuna con le giornate di allenamento. Ogni giornata ha vari esercizi. Poi c'è lo storico, e le statistiche, con l'indice 1RM, che dà un'idea di massima dello sforzo.",5
workout.progression.lite,A Google user,"Amazing app, have been using for two years now and the simple interface and features like the rest timer and live workout tracking are hard to beat. To the author, should they ever read this, if we could get Tasker integrations (begin workout, complete set, next set...) this app would be perfect.",4
workout.progression.lite,A Google user,The best gym workout app I've tried... and I've tried quite a few. My search is over. 💪,5
workout.progression.lite,A Google user,App is great but Wear OS compatibility is severely lacking. Unable to scroll by using the crown and also notifications on watch does not take you back to the app.,3
workout.progression.lite,A Google user,Good app design but without updates or exercise photos :((,2
workout.progression.lite,A Google user,"Good one. Big list of exercise, links to YouTube. Lack of pictures, but it's minor.",5
workout.progression.lite,A Google user,"I love this app! Nice sleek interface, easy to use, includes a lot of information without being complicated.",5
workout.progression.lite,A Google user,"I can't save any workouts even though I went though and ""completed workout"" via wear os device. Why? I also have no history and cannot log in via any gogglebaervoved. Uninstalled",1
workout.progression.lite,A Google user,It would be better IF we can see the results. I can see numbers but cant see progression (tension or volume) In the other hand user cant make super set (group) Btw i like it,3
workout.progression.lite,A Google user,Really good app,5
workout.progression.lite,A Google user,Love the app. Really easy to track what I've done once I've made a schedule though the creation of a schedule isn't always that intuitive initially. An idea to make this schedule creation easier is if the list of exercises menu only cover half the screen s you can see what you've got on your list more easily. Will this app get WearOS support at some point? That would be a killer feature.,4
workout.progression.lite,A Google user,"I was looking for a way to track my weight training and get credit in Google Fit in order to earn points in my company's wellness plan. The first day seemed to work and show the correct data in Google Fit, but partway through my day, my data in Google Fit was partially lost. It shows that I trained in the morning, but my move minutes, heart points, calorie burn and heart rate data is gone. disconnected Progression from Google Fit and reconnecting it did nothing to solve the problem. Update: Not long after writing this review and uninstalling the app, Google Fit seems to be giving me credit for the workout all of a sudden. I'm not sure what's going on. Feeback: I often map out my lifts before setting foot in the gym, so I know what each and every set's weight and rep goal is ahead of time. I'd like to do that in this app, so I can just open it up and it tells me what to load onto the bar.",2
workout.progression.lite,A Google user,This is my jam.,5
workout.progression.lite,A Google user,"In general one of the best on the market. But, what's missing is possibility to view all history in calendar view. That's a big minus. I paid for the full version and I'm a user for more than a year now, and I would really appreciate if you could do that update and possibility to scroll through the years and days and look all the passed workouts in that view it would be 5+. ;)",4
workout.progression.lite,A Google user,The app is fine but not great. I have the pro version but what they really need to do is look at other work out apps and figure out how to utilize the best features from them while doing a severe overhaul of their UI. The UI is not user friendly or intuitive.,3
workout.progression.lite,A Google user,Samsung health Integration would be 5/5,4
workout.progression.lite,A Google user,"Great and super usefull to keep you on track. great support, thanks!",5
workout.progression.lite,A Google user,"Useful & Reliable. Progression Workout Tracker is a simple workout tracking app that is easy to use and offers everything I need. I like that it works well on/off line and automatically backs up my data. The Wear OS intergration needs a little refinement, but is definitely useable. Overall a great app.",5
workout.progression.lite,A Google user,"Great app! The pro version is worth it. Clean interface and easier to use than other apps. Added functionality to integrate with HR and Calories from trackers like Fitbit, etc would be really helpful and make the app a complete package. And a few more added exercises (variations of existing ones) would be awesome. A progression tracker definately helps build confidence and also plan accordingly. Great job!",4
workout.progression.lite,A Google user,"Edit: Exported CSV file does not actually include exercise data. More let downs: 1. Day ends at midnight rather than say 4am, so history is messed up for people who exercise late at night. 2. Notes are not linked to the exercise, so have to add notes again each time add exercise to something. 3. Editing name or type (weight/time based) for a custom exercise does not update it in schedule. 4. Connecting with google drive broken. 5. No images for exercises and setting to download them is broken.",3
workout.progression.lite,A Google user,Mediocre,3
workout.progression.lite,A Google user,This has been a really useful tool but it would be nice to track bodyweight with completed workouts. Even better if calories burned correlated to that weight.,4
workout.progression.lite,A Google user,"The app is really good. I like the interface. It feels clean and well organized. I purchased the pro version and the statistics and analysis are really helpful. It only misses a calendar option (you have the workout history, but it is not the same). very good job developer. If it ever gets the calendar, I will update my review to 5 stars.",4
workout.progression.lite,A Google user,"Started using it today. Was impressed with the functionality. Visually good. My only beef is that i should be able to mark warm up sets separately from my working sets. Update - 3 years still my favourite app, except when I run wendlers. I don't think there is anything else better than this",5
workout.progression.lite,A Google user,"I really liked the app and decided to pay for it a year back, but now I'm fed up with it. It has twice lost my whole history due to some bug, first after 77 workouts, and now after 61 workouts. A small part of the data remains but most is lost. After the first time I decided to simply start my log again from scratch hoping it was some weird fluke. Now that it happened to me again - well, I just need to throw it away.  EDIT: The problem is with my Xiaomi phone. Only fair that I change the rating accordingly, because outside of the issues I'm having this is the only workout tracker that I like.",5
workout.progression.lite,A Google user,"i like the app. I wish it had time settings. For treadmill, elliptical, stairs, or just planks.",4
workout.progression.lite,A Google user,"I've been using this app for about 6 weeks and thought I'd give some feedback.  The app is awesome in it's simplicity ... no fancy graphics, no instructional videos... just a great Material Design... very intuitive.  Tracks progress of both your workouts in terms of weight or time, and their is a companion app to track your Body stats.  Add your own exercises complete with weight or time based, the body part your exercising, and equipment.  You can add exercises to groups (Supersets), add rest periods between exercises, and haven't found the upper limit on sets or reps.  I'd give it 5 stars but there is one major flaw that I really don't understand.  The whole app is structured around a schedule.  So you create a workout schedule, and you give each day of the schedule a name, and assign exercises to the schedule for that day.  Huh?  It is the most back assward way of doing things I've ever seen.  There is no need for a ""schedule"" at all.  The app tracks your workouts and tells you exactly when you did them and gives you stats on them.  Just give me my exercises and the ability to create workouts.  I'll choose the workout I want to do on the day I want to do it thanks.",4
workout.progression.lite,A Google user,Love the app and looking forward to the next update. It would be great to have more stat's and ways of measuring improvement or previous Workouts. This might be a stretch but an online dashboard and way of adding Workouts would be incredible. Look forward to continuing to support your great work!,5
workout.progression.lite,A Google user,progression.. that won't show your pregression unless you pay,3
workout.progression.lite,A Google user,"Best app, simple and easy to use! I don't pay often for apps here, but this one is worth it",5
workout.progression.lite,A Google user,This is easily one of the best apps I've ever used.  It's the perfect blend of flexibility and automation.  I can find workouts I enjoy and very easily customize them to my liking.  Mad props to the developer.  I'm going to be sad if/when development ends on this app.,5
workout.progression.lite,A Google user,"Update: Still works great. Would it be possible to sync to Garmin watches (Garmin Connect)? I've tried many workout apps for the gym and I have been really happy with this one. Finally found the one app that does everything I need in the gym. And, its very easy to use with great features. Also Dev is great. Emailed him about an issue with changing a device. He returned my email promptly even though he was on vacation! So, good I paid for the Pro version twice. Update: Google Drive!!! Awesome!",5
workout.progression.lite,A Google user,This is the best fitness tracker I have ever used! Highly recommend it.,5
workout.progression.lite,A Google user,"Best workout tracking app I've used. Theres a few quirks that you get used to real quick, and once you have it down pat its a wonderful workout tracker.",5
workout.progression.lite,A Google user,why does it need access to my photos and personal contacts??,1
workout.progression.lite,A Google user,"I have been using this app for over 3 years, I love the simplicity but also the amount of information you can feed into it if wanted. it is easy to program workouts and also change them on the fly, also your complete history of an exercise is shown when you are performing an exercise which is invaluable. I can't recommend this app enough, best fitness tracker!!",5
workout.progression.lite,A Google user,havent used it yet,1
workout.progression.lite,A Google user,"loving it so far, I like that it has many popular programs present, built my own in about a minute",5
workout.progression.lite,A Google user,Good basic functionality. Here are a suggestions 1) Add precentage 1rm and RPE targets for program design. 2) Add RPE to set annotation. 3) Add an option to use RPE to calculate maxes. 4) Allow user created custom categories for muscle groups and movement patterns. 5) Add analysis for weekly volume and sets by category.,4
workout.progression.lite,A Google user,I bought the full version because I like how clean and intuitive the interface is. But it's twice completely reset and forgotten all my workouts and history. Incredibly frustrating.,1
workout.progression.lite,A Google user,Ive been a faithful user for over 2 years. I love the history tracking to compare my progress.,5
workout.progression.lite,A Google user,hard to use. how can i change kg to pounds? it is so hard trying to be converting everything. we are un usa everything is listed in stupid pounds.,2
workout.progression.lite,A Google user,"Really simple app, and by that i mean straight forward. No gimmicks or fancy graphics, just straight up workout tracking. No subscription either which is a huge bonus. it's impossible to find fitness apps now that don't have some sort of sub model. There's a good range of individual workouts in the database and a few predefined routines to work from. Tracking is simple and settng up your own custom routines is dead easy. Haven't had any performance issues either.",5
workout.progression.lite,A Google user,me likey,5
workout.progression.lite,A Google user,"I think this is the best ,",5
workout.progression.lite,A Google user,option to automatically backup to google drive is great.,5
workout.progression.lite,A Google user,"Good app but it's been years since the last update, what happened to the developer? How about a new feature where exercises that are added midway during a workout will get saved so that next time i dont have to add it in again? [update] Improved rating to 4 stars due to dev's quick response, looking forward to new update, will give 5 stars when that happens",4
workout.progression.lite,A Google user,"This is the most straightforward workout tracker I've used for Android. The only thing I wish it had is the ability to use a desktop program or app to create workouts and sync those with the mobile app. It can be a little tedious adding a long term program that varies from week to week (percentages, variable reps and sets, etc.), but that's the only thing I can think of that would make this thing absolutely perfect for me.",5
workout.progression.lite,A Google user,"I wish it was possible to get the pro upgrade for the weight tracker and workout tracker together at a discount. Aside from this, its a fantastic and fluid app. Extremely user friendly.",5
workout.progression.lite,A Google user,"great app. I was wondering if u can add a feature where it would clearly show something like your best 1rm, 2rm ,3rm, 4rm etc etc. for each exercise",5
workout.progression.lite,A Google user,"Fantastic value for the price compared to other subscription based apps (JEFIT, BodyBuilding, etc). The simplicity and intuitiveness of the app are spot on. A few feature requests: - Picture/gif functionality for custom exercises - Tempo timer (2 second lift, 0 second rest at top, 1 second lower, etc) - Expand Exercise Library (both number of exercises and information per exercise)",5
workout.progression.lite,A Google user,"Great app. Really helps me organize my workouts. I'm spending less time in the gym, but I leave feeling like I got a better workout than before. Highly reccomend.",5
workout.progression.lite,A Google user,Really great UI and simple to use. I had been looking for an app like this for so long. The preset programs are interesting to look at as well. It helps me get pumped when I'm in the gym and keep a good track of my progress. It has been a real lifebloom and kept me in wild shape.,5
workout.progression.lite,A Google user,Quick and versatile app for gym training.,5
