Package name,Reviewer name,Review,Rating
workout.progression.lite,Leaving Scotland,The stats page is hidden behind a paywall.,1
workout.progression.lite,Eternity Prevails,This app is not intuitive or easy to use,2
workout.progression.lite,Dalil Elbazzaz,"Hi, the app is almost perfect for me. I do have one annoying thing. When the alarm of the timer goed off and phone is not on standby the volume will be set lower of my music and I can not put the music volume up again. Pretty hard to explain. Am I the only one?",4
workout.progression.lite,David Cunningham,Just download and try. If you intend to get strong then it really is worth the effort to move your thumb over install,5
workout.progression.lite,Anton Wenemoser,The app isn't that great anymore. It would be way better to have animations/drawings for the most common excersises.,5
workout.progression.lite,Daniel Felipe Gil Gamboa,"100$ are way too much in my country, I'm from latam. I only want to create a custom program and export to csv but that price is too much... :(",1
workout.progression.lite,Massimo,The app is basic but has everything you need to record your session and keep track of your progress. Also the developer (Zoltan) is always willing to help and to give you a quick feedback if needed.,5
workout.progression.lite,Robi Dani,100 dollars? No thanks,1
workout.progression.lite,Nokin,"It's a very good app to track your progress. But if we had the option to create our own workouts, it would be very nice because some exercises are not in the app.",5
workout.progression.lite,william y karen Ortega,Does the developer really think this app is worth almost 100U$? It is not bad as app but i am sorry I remove it right away because of the price. Please be reasonable some apps like Fit on has trainers and it cost way way less. Nice app but sorry about the pricing i hope this comment help the developers to remain in the game.,2
workout.progression.lite,Mamad del Rosario,Simple and very easy to use,5
workout.progression.lite,Omari Blackman,Great app. Been using it for about 5 years. Have loads of data on my progression;). Some updates have not been as smooth as others but the app more than makes up for it.,5
workout.progression.lite,Damon Leavitt,Adding exercises used to be easy on this app. Now it's so glitchy using paper is the better option. It adds multiples of the same exercise and you can't get rid of the extras. I'm giving it a three because it used to be a great app.,3
workout.progression.lite,Michael Hughes,Great app for tracking and planning workouts,5
workout.progression.lite,Michael Soto,"Great simple tracking, no ads",5
workout.progression.lite,John Christensen,Easy to use app with all the features I want in my workout app. Developer is very responsive and helpful with any issues I've had.,5
workout.progression.lite,Walter Luigi,Great app. Just wish it had a way to log RPE/RIR for my work sets. If it's there I haven't found it yet.,4
workout.progression.lite,Michael May,Great. Wish there was an ios version too.,5
workout.progression.lite,BeastOfNature,"Great app as a whole. But there are one or two things that bother me. First is the exercise search. If I want to search for incline dumbbell bench press, typing in ""dumbell incline"" returns no results, but ""Incline dumbbell"" does. This leads to me thinking the app doesn't have the exercise just because I didn't type it out exactly how the app has it. Secondly is support for warm up sets and RPE and %1RM would be great.",4
workout.progression.lite,Megan Kennington,"Download this if you would like to lose all your data and workouts. I was a big fan before upgrade, paid for premium, but am unable to resync anything for some reason... It's not worth setting everything up again honestly",1
workout.progression.lite,Aaron Hohlt,Best workout tracking app,5
workout.progression.lite,Craig Neu,"Used to be a simple if slightly buggy fitness tracker, very feature-scarce but I didn't mind that. I paid a small fee to unlock it and was happy with the barebones experience because it was all I needed. Now, the dev has locked basic features behind a costly subscription, a laughable proposition considering how lackluster the app is and likely will continue to be. Avoid, there are much better options out there. Reddit recommends FitNotes.",1
workout.progression.lite,Jay Taylor,Thanks for all the updates!! The best weight lifting trackers and more!!!,5
workout.progression.lite,Eric Grossman,"I love every aspect of this app. It has effective design, intuitive controls for logging data, extensive catalogs of exercises that are easy to navigate, and every tool needed — from a plate calculator to a stopwatch. It's impressive when an app has so much capability, yet is still easy to use. Great work.",5
workout.progression.lite,Jamie Thompson,Another great update - already the best workout tracker on the app store!,5
workout.progression.lite,James I,I love this app - nothing comes close in my opinion. Just one thing - during a workout I will use the notes or comments feature and refer back to it for my next workout..but how do I view these? If I go to 'history' and then click on the workout I can't see any notes. How can I view these?,5
workout.progression.lite,Hrvoje Dokoza,"Looking for an app that has almost everything? Look no more. I've been using this app for the last five years. Today, for the first time, I had a problem. Zoltan responded immediately and solved the problem in no time. I've also tried much more expensive apps on the market, but none compare to Progression. Some small things are missing, such as calendar view, and a few other little things, but the app is worth the investment.",5
workout.progression.lite,Hbmonkey9,Been using this app for years.. They removed a bunch of features and hid them behind a monthly subscription. Don't recommend this app anymore moving to Strong.,1
workout.progression.lite,Bupé,"Ahhh man they messed it up 😩😩 I used to be a fan of this back in the old interface. Was clear with pictures, straight forward. This new interface is boring, just another app, unengaging... Go back to old school!!",2
workout.progression.lite,Kallen Hager,It don't work right anymore :(,2
workout.progression.lite,Emre Aral,"I've been using this app for years and it's been so easy to create and manage routines, workouts and my progress. I enjoy looking at all the stats too. But I'm not a fan of some of the user experience changes in the latest major update. Before the update, during a workout, I could tap a set from a previous workout and any comments saved to the previous set would be pre-filled for the current set - now I can no longer single-tap copy a comment from a previous set and have to type it out every time. I use comments a lot and this change is time consuming in the middle of a workout. There is also no more Edit Comment button in the three dot menu next to a set (moved to the bottom of the screen, I prefer it in the previous location.) Also, sometimes I need to add a comment to a previous set in the CURRENT workout but now there is an additional Update button to tap after tapping OK to save the comment. Because this button is new, I forget to tap it sometimes, and I don't realise that a previous set is still highlighted with an unsaved comment, so I accidentally overwrite the set with the numbers for the next completed set. Please revert the commenting and editing experience to the previous iteration!",4
workout.progression.lite,Paul Durham,Can't edit workouts once saved! Can look back through workout history but cannot edit times or distances for any particular workout.,2
workout.progression.lite,Zach A,Was there a recent update? The font changed and the app has become laggier to input. The plate calculator is incorrect too. I've used this app for years with no complaints. Please let me know what changed. I will revise my app if this is fixed.,1
workout.progression.lite,Bosco Domingo,"This new update removed the ability to drag exercises around to reorder them and instead you have to chose ""Move up"" or ""Move down"". I mistakenly thought the author deleted my original 3-star review, and it was Google Play messing up. The app is certainly good (I even paid for the no-ads version), I hate not having that functionality and would like to see it come back and he seems like a nice person over emails. Sorry for the misunderstanding!",5
workout.progression.lite,Norman Hu,"Great app, been using it for years. Latest update solves most of the issues with the new version.",5
workout.progression.lite,Erick Orozco,"Amazing app. Absolutely love it. Already comes with a bunch of pre-loaded exercise and workouts, and has the option to add new exercises and routines that are missing.",5
workout.progression.lite,Gatlee Kaw,It's working again! Favourite workout tracking app for sure,5
workout.progression.lite,Anton Hoskam,This is the absolute best workout tracker for the gym.,5
workout.progression.lite,David,"Used to be a very good app, easy to use and perfect for tracking progress. Unfortunately the last update greatly decreased the performance on my phone, everything feels slow and sluggish and often the first numbers are not recognized when typing. Please try to increase performance again! :(",3
workout.progression.lite,Marc Labrecque,Great app,5
workout.progression.lite,Max Stober,where d0 i donate you rock also is there a git hub i can contribute to ?,5
workout.progression.lite,JP Addison,Very user-friendly features. Nice work.,5
workout.progression.lite,Trevor McCain,"Been using this tracker for a few years now and haven't found one I like better yet. Simple and easy to use, it's great for my purposes. Looking forward to new features with the next update.",5
workout.progression.lite,Stepan Kornyakov,"This used to be a great app, right until the major update. Unfortunately, the update really screwed up a lot of things. Here are the things that absolutely need to be added back asap: - full backup and restore (how are we supposed to change phones without losing all data?), - sync with Google Fit, - take weight and repetitions from the corresponding set in the previous session, not just from the previous set in the current session, - showing the rest timer even when it goes below 0:00. Thanks!",3
workout.progression.lite,Riley,Definelty not female friendly...,1
workout.progression.lite,Andrew Kovatch,"I've been using this app for years and it's perfect for what it does. Had some issues with the the latest update, importing data to lbs vs kg, but once I inreimported everything is good. Developer continues to add new features while maintaining the simplicity that makes this app great. Highly recommended.",5
workout.progression.lite,Laura Lee,"I love using this app and have done for years. It's so helpful being able to put together my own plans. The developer always replies quickly to any queries, thank you!",5
workout.progression.lite,Ξ Π,"This is an undated review given the new updates to the app. You've made it far worse, I can no longer export at all, when I go into the app to view my stats, I see some graphs ""volume, max weight, max 1rm etc"" but no ability to drill down into the movements themselves. I can't see my max deadlift, or how much bench press volume I've done, or how many sessions I had in Sept. How is this better? Are we waiting for more updates? I bought this app because of how much visibility it gave me into my long term lifting stats, it looks like you've been progressively removing that functionality. ""Export to csv as it stands is far too restricted. The csv export ought to be far more granular. I should be able to see what movement I did, when, and with what weight. All of that data is sitting in the app, so when I export it, I'd like to see it. I don't need my raw data to be curated. I'd like to be able to build my own graphs, create my own projections etc. Additionally, being able to see the frequency of my sessions, by week, month etc. Anyhow, great application, but giving users more access to their data would be nice.""",2
workout.progression.lite,JoaoMVR,Been using this for a long time and love it for its simplicity and versatility.,5
workout.progression.lite,Lisa,Was great but since update the rest timer doesn't continue after set rest time and there's no way to import data. Hate it now,2
workout.progression.lite,Adriano Ariganello,"I love the app. I use it with a bunch of custom workouts I switch between every few weeks. Even when it's missing particular exercises, it's very easy to add them. One feature I'd love to see is a quick way to review a set - easy, hard, etc. I'm using the comments to do that now so I know when to up the weight. It would be great if this was built in.",5
workout.progression.lite,Jeff L,"It's still very good, just wish we could connect to Google Fit like in previous versions.",4
workout.progression.lite,Matt Lavin,It's the minimum you need to track workouts,3
workout.progression.lite,Justin Snell,Phenomenally designed app with a rich feature set balanced perfectly with simplicity and ease of use. Glad the dev is back at it!,5
workout.progression.lite,John Smith,"Older version was simply superior in terms of functionality. New version looks pretty but lacks a persistent rest timer, lacks a rest timer that can continue timing into negatives and lacks easy to view stats of previous workouts all at once (all of which were in the older version). Why take out features?",3
workout.progression.lite,Eric S,"Was my favorite app, my phone auto updated when I was on wifi and version 2.0 is unbearable. Everything converted weird and the plate calculations can no longer adjust. I will be looking for a new work out app unfortunately.",1
workout.progression.lite,Braxton King,Can you bring back the previous statistical view? Making everything into one big graph makes it too hard to see individual data points. Also much harder to know what my personal best is for any particular exercise.,3
workout.progression.lite,Борис Шемраев,This app is unintuitive. I spent 20 minutes and still no idea how to use it and what to click. Not for me,2
workout.progression.lite,luntiang pentakulo,Design is simple and interface is very user-friendly. Exercises and programs are flexible and highly customizable. Being able to backup data to Google is also a plus. Can't wait for the upcoming updates (Google Fit and Import/Export)!,5
workout.progression.lite,Armando Ibarra,"Great way to create custom workouts. If you want to take your workouts to the next level by analyzing data, this is it. I wish it had tizen support though....",5
workout.progression.lite,John Gauthier,"After 5+ years, this is still the best lifting app on the market. Has all the functionality I need and is easy to use. The update was a surprise, but it's turning out to be a welcome one. At it's core the app still provides what I need, but now it has a fresh new design.",5
workout.progression.lite,James Wong,"Really hoping for features to come back after the update, it's hampering the experience. Also wish there was a way to import a spreadsheet, or a way to edit online without having to input them manually on my phone which can be time consuming. I've looked to Simple Workout Log for this feature as I can add my exercises a lot faster - would gladly pay a small fee to fund this as the rest of the features of Progression are superior.",4
workout.progression.lite,Lyle Schemmerling,Google Fit sync still not working after the update. Was there before. What gives?,2
workout.progression.lite,Anant Chowdhary,The statistics page has suddenly been rendered useless after the latest update. Is there a volume per exercise based graph anymore ? Thank you,5
workout.progression.lite,Guido Smeets,Hands down the most user friendly gym tracker in the market.,5
workout.progression.lite,Rishabh Sharma,Update made it completely rubbish,2
workout.progression.lite,Alastair Finlay,"Was a big big fan of this application before the upgrade. The new graphs aren't helpful to me at all. We've lost the automatic 1RM calculations, there's no pie chart at the end of workouts and the once ""easy to use and understand"" historical data now appears as a big lump of graph.",3
workout.progression.lite,Dion Chong,"Easy to use, visually pleasing. Perhaps I'm less fussed as a newer user than those who have been using this app for some time. However, it seems like I just missed the boat for Pro. I already dislike apps with a subscription model, and the cost of Premium is too high. Dev seems great, and were this the Action Launcher model I'd be more than happy to support. As it stands, I'm going back to FitNotes",2
workout.progression.lite,Josh Kellett,"Was my favourite app, period, until the recent updates. Overall much less pleasant to use, workouts don't seem to complete when I tell them to, all my historical data got updated to kilos, etc. Extra star is for nostalgia.",2
workout.progression.lite,Caroline Jones,"Edit: down to 4 stars. Still love the app, don't like the new update sooo side-loaded the old version .apk from APKPure. Happy again!",4
workout.progression.lite,B. M. S.,I'm changing my review from the previous. Developer reached out and I was able to import my previous workouts. Great app.,5
workout.progression.lite,Luis Linarez,"Over 5 years waiting. Paid for pro years ago. And for what? A UI change? To anyone reading this, it's useful but doesn't have half the features of what any other app has at this point. Don't ever spend a dime on this place. Like myself a lot of us did years ago, and it's been a nonstop roller coaster of reasons and excuses and explanations of why this never got meaningful updates. So enjoy it as a free product, nothing more.",1
workout.progression.lite,dd W,"Clean design, intuitive functionality, great developer support ... well worth the price of a cup of coffee for the upgrade. This workout tracker is by far the best of the many I have tried over the years. Very pleased.",5
workout.progression.lite,Michael Tavener,It says I can import my old data by hitting a button... But that button isn't visible and I can't scroll to it. Bummer.,3
workout.progression.lite,Steph,App is working great again. Thanks to the developer for working on this! By far my favourite app for tracking workouts and exercise history.,5
workout.progression.lite,Ronen Schwarz,"Have been using this app for years, Android 11 did cause it to break, but now it's working and better than ever with 2.0. Cannot recommend this app enough, have shown it to many people in person!",5
workout.progression.lite,Tim Paglione,"It seems to have lost some functionality - won't stop the screen from sleeping (have to set in settings before each use, it doesn't stick), doesn't make the sound after the timer stops, the timer button pens the time selector but won't start. All these are turned on in the settings.",3
workout.progression.lite,silverwhite11,"not easy to add, keep on loop round and round, when trying to add",2
workout.progression.lite,Rich Spoon,So glad this has been updated and is finally back! Best workout app there is by far!,5
workout.progression.lite,Rossp P,Had some issues with the app. Developer has reached out incredibly quickly to resolve any problems,5
workout.progression.lite,Ben,Please bring back the timer as it's one of the most important features. It's annoying to have to twitch between different apps but other than that I'm glad to see this app back,3
workout.progression.lite,aditya khot,Perfect workout and workout log companion. Keeps on improving.,5
workout.progression.lite,Tim Bremner,I dont get it. Totally overhauled the interface and every change seems to have been for the worse.,2
workout.progression.lite,Ojas Parashar,Edit 1: Mr. Demant seems like a stand up guy and I've shot him an email with all the features that the old app had that the new one doesn't + some ideas on where to take the app in the future. I'll keep updating the review as Mr. Demant updates the app! Original: The new update has added a fancy UI at the cost of app functionality. I cant see what my estimated 1RM max is anymore. - it just shows a graph and I can't pull the numbers. Seeing historical without days requires me to select a workout. Just seems like pointless changes. I'd really like an option to rollback.,2
workout.progression.lite,Wookiee81,"It's clean and simple. Such a relief with all the flashy colourful apps out there there try to overcomplicate a process that is essentially lift weight, wait. Does what you need. Highly recommend.",5
workout.progression.lite,Amado González Rodríguez,Nice redisign and I have all my previous data back,5
workout.progression.lite,Davide De Rosa,"Best tracking app hands down. Strong sucks in comparison, beyond being extremely buggy and overpriced. UPDATE: not happy at all about the update, will report bugs I found along the way.",2
workout.progression.lite,Andrew Passarello,thanks for updating to make it work on Android 11,5
workout.progression.lite,Alex Marshall,"Quite buggy after recent major update. Stats not being recorded correctly, supersets not working correctly, etc. Uninstalling for now. Previous version of app worked great.",2
workout.progression.lite,jacob g,"New statistics page is harder to read, I can't tell what my estimated 1 rep max is anymore because it's now a chart. I'd love for the current one to be included, but the old statistics page was more useful.",4
workout.progression.lite,Pramoth Rengan,Been using this app for 2 years . The new update is not logging my history anymore. It only shows my workout history before the update only.,4
workout.progression.lite,Bret Toews,"Love the new redesign so far, nicely done! My old workouts did import in KG even though I specified LB.",5
workout.progression.lite,Andrew Cam,"My review previously was an average review, but the developer responded quickly and changed this entire thing around. Evidently, my issue was my own fault, and he quickly resolved it. I'm excited to see where he takes this app further. Cheers, and this app is well worth it.",5
workout.progression.lite,Brandon H,"Not a big fan of this update as someone who has been using the app for many years. When I imported my information from the previous version, the import didn't exactly translate very well and I had to go back and edit the program to bring it back to it's original state. I found it somewhat tedious to rewrite my program, as the first two exercises of every workout were removed from the superset. I found the process for writing down the supersets to be much less intuitive than the older version.",2
workout.progression.lite,Leon Baker,"I've used this app for years and it's done about 90 percent of what I need very well. I guess it's going under a revamp... My workout routines are gone. I have to use my history to pull up a workout. I changed settings to lbs but my past sets are kg so I'm not sure where to start without a calculation. Google fit sync is gone... I'm just a sad panda. This morning's workout is super frustrating. I guess if your a new user, this app is gonna be awesome. It does look slick now.",2
workout.progression.lite,Dandy Park,"This is by far the best workout logging app I've ever tried. The update to 2.0 was a bit bumpy – I thought my 2+ years of data had vanished, but it was just a matter of finding the right import option in the settings. The developer was exceptionally responsive and helpful. The new update looks very exciting, and I'm really looking forward to the new features - thanks for creating such a great product, Zoltan!",5
workout.progression.lite,Ray,The only resistance training tracker app that I use. The Watch App should be back soon for it.,5
workout.progression.lite,Soufin Rahimeen,Newest update deleted all my saved workout plans and workout history.,1
workout.progression.lite,julian “Julian” calendar,"Great app, been using it for years. I'm no longer able to use the Google drive sync feature. Bought a new phone and don't have access to my old custom workouts. Going this feature gets fixed. Otherwise 5 start app.",3
workout.progression.lite,Dilwar Miah,Garbage app doesn't even save workouts,1
workout.progression.lite,Rebecca Wilson,Since having to change over to a new phone I can't get any of my data from my old phone. I'm signed into google drive but that doesn't seem to do anything. Also the app on my new phone won't let me even start a workout...,1
workout.progression.lite,Ian Hyzy,Tapping a new schedule and clicking add schedule just kicks me back to the home screen with the old schedule,3
workout.progression.lite,Jeric Ilagan,Horrible. Randomly lost 2 years worth of progress reports and saved workouts. App is now not letting make any changes to the workouts,1
workout.progression.lite,Rostyslav Roshak,Lost all the progress after update.,1
workout.progression.lite,Matthew Torres,Bought the App years ago because it was very customizable. The new update fixes all the drawbacks and kept all the positives. Have only used one fitness app because this is the best.,5
workout.progression.lite,Daniel G,Its not letting me create my own workout routine. Whats going on?,3
workout.progression.lite,Conor Kay,Doesn't save custom schedules anymore,1
workout.progression.lite,Brian K,"I've used the app for the past year. I've been very happy with it. It's currently going thru a revamp, so some features are in process, but it is an app I use several days a week. The developer is extremely responsive. Cannot recommend highly enough",5
workout.progression.lite,Michael,"I'm sad that the android 11 update seems to have broken this app. It was my go-to lifting app for the last couple years. I lost all my records and custom workouts. I had it set to auto backup to Google drive, and the file is still there, but the app can't seem to see it.",2
