Package name,Reviewer name,Review,Rating
workout.progression.lite,A Google user,"Love this app, especially the integration with Android Wear... Saves me having to unlock my phone after every set and it's great that the rest timer automatically fires after each set and vibrates to let me know it's time for the next set.",5
workout.progression.lite,A Google user,Only good if you purchase upgrade.,2
workout.progression.lite,A Google user,I like the app a lot but wish the calorie calculator for the cardio activities would take your entered weight into account or allow for you to manually enter it from the total the machine says.,4
workout.progression.lite,A Google user,Amazing app. Very intuitive and user-friendly. They have a large database of exercises and it's fully customizable. Syncs with Google fit... I'm excited to see where this goes in the future,5
workout.progression.lite,A Google user,"A pleasure to use. Two usability requests: 1. Ability to set equipment weight without going into plate calculator. My workout uses bars of different weights, and having to change the equipment weight for each excercise all the time is annoying. 2. Custom available plates. I live in a metric country. The available plates are 2k, 3k, 5k, 10k. The preset available plates are close but not quite. Being able to customize them to fit a gym setup will be nice. Other than these 2 points I have no more complaints. Perfect user experience otherwise 👌💯",4
workout.progression.lite,A Google user,"Nice app to plan and track your workouts, either existing or custom exercises. Missing features in my opinion: ability to set the timer to ring after X seconds or minutes (e.g. I don't want look at my phone when holding a plank) / ability to add a description to each step individually (e.g. Step 1 is left leg up, step 2 right leg up, etc.)",4
workout.progression.lite,A Google user,This is the best strength training app that I've used. The automatic rest timer is great and I like the stats that it provides after your workout. Great app.,5
workout.progression.lite,A Google user,"This is a fantastic app works well with me watch as well, so as a newbie to the world of the gym this is a life saver and pro is great upgrade as well.",5
workout.progression.lite,A Google user,"I try to use this app but it won't let me give it access... dont know if it is a glitch or what. If the app developer fixes this my review will change, but until then it will stay.",5
workout.progression.lite,A Google user,"Finally a simple workout tracking app, clean and simple. Easy to use. A couple requests: add a rest timer between exercises. For example I rest 1:30 between sets and 3:00 between exercises. The ability to share routines with other user would be cool too. Thank you!",5
workout.progression.lite,A Google user,"Perfect material design and a fantastic app all-around. I use it every time I hit the gym.   One suggestion is when you complete an exercise and are on to a different day or workout, I'd love a ""suggested weight"" entry rather than just the same one you already completed. For instance, if I squat 200 lbs 5 times, then two days later I go to squat again it would be nice if it said 205 or 210 based on the last workout I did. Of course it would still be editable.  Thanks!",5
workout.progression.lite,A Google user,"Great app, compared to others. Would be nice to include sprint training with reps as an exercise, though. Keep up the good work!",4
workout.progression.lite,A Google user,Really like the app. Good setup. Would've given it 5 stars if I was able to add my own exercises that are not on the list in the app. Please do an update to add exercises to library.,4
workout.progression.lite,A Google user,Great App. Very wide array of exercises. One thing I'd like to do is to copy a workout schedule once I create it. Alot of schedules are similar but have tweaks. That would be a great improvement. Otherwise very happy with it.,4
workout.progression.lite,A Google user,Great app. I wish there was an option to save any routine from the history as my routine which can be selected quickly next time.,5
workout.progression.lite,A Google user,"Using this after having used another lifting  app for many years. I really like the simple look of this app and the floating count down, and it syncs with Google Fit.   I think the app does lack some features I'd like to see. For example, I'd like to see if I set a new weight record during my rep (not on a stat page later). Also, I'd like to assign a day to a workout like ""Back - Monday"" instead of just Day 1, Day 2, etc. Also, I'd like to see more exercises in the database, and actual images of the workout instead of a colored letter. I'd upgrade for all that!",4
workout.progression.lite,A Google user,Great App. Very useful only wish there was a way to display the reps previously setup in Schedules for each set on the wear app. Then the app can go to the reps/weight instead of starting at 0 each time you enter a set.,4
workout.progression.lite,A Google user,"Ok, so I had given this 2 stars because it wasn't able to save after the workout. The developer Zoltan is brilliant. He knew something I had forgotten which impaired Progression from working: I turned off animations on my Nexus 6P many moons ago. I just started working out again and couldn't save it this go round. Now after my workout, the save button appears ... magic. Crisis averted. I do not have to use crappy competitor products. This is the best workout app out there and it syncs with Google Fit.",5
workout.progression.lite,A Google user,My favorite fitness tracker app! Would be cool to be able to set a range for the rest timer (ex. 2-3 minutes) where it beeps twice.,5
workout.progression.lite,A Google user,Hey; I love this app but want to be able to log the weights I did. I am more then willing to pay $5 to upgrade but which upgrade do I get to log the weights I use? Thanks.,5
workout.progression.lite,A Google user,"Adding another review, cannot say enough about Zoltan and this app. The best thing for anyone who wants to track their gym progress, make custom programs, and analyze their progress. Outstanding work, and quick developer response times. Simply amazing! Thanks for everything Zoltan, means alot to everyone and the fitness community",5
workout.progression.lite,A Google user,"Could easily have been a 5 if it were not for the very disappointing upgrade path. The issue is that to track your weight, you need a SEPARATE app, for which you need to pay AGAIN to upgrade. And when all added, these ""group of apps"" becomes ridiculously expensive. IMO, shouldn't be needing to pay extra to get proper weight tracking when other apps just have it built in.  P.S. More than happy to give this a 5 if a more reasonable upgrade path is setup in the future.",3
workout.progression.lite,A Google user,"Great app, wish there was a way to add custom plate weights.",4
workout.progression.lite,A Google user,"I love this app. Great design, easy and fast to use, and even really informative with the guides.  Had an issue where I lost my progress but that was due to my phone. Thank you for the reply Dev.",1
workout.progression.lite,A Google user,"Was working great and looked like a great app. Then it randomly deleted the workout I created, as well as my workout history. :(",2
workout.progression.lite,A Google user,"UI is amazing, easy to use ! Importing workouts from CSV/JSON file would be awesome. Nevertheless,amazing app overall ! No bugs :D",5
workout.progression.lite,A Google user,Great all around app,5
workout.progression.lite,A Google user,"I need help. I already purchased the paid version for this but when I did a restore factory setting, It showed that I need to pay again.   Unlike other apps, they have the word ""purchased"" on the ""install"", but this one I need to buy again? Why?",2
workout.progression.lite,A Google user,Absolutely love this app. Couldn't be without it now. Well worth the funny price tag to get premium.,5
workout.progression.lite,A Google user,Just fantastic tracking capabilities both during and out of workouts. The standalone feature for Android Wear allows me to leave the phone in the wardrobe.,5
workout.progression.lite,A Google user,Great app that has helped me stick to working out. Can easily schedule a workout and modify it to fit my needs. Really like the simplicity of it.,5
workout.progression.lite,A Google user,"Will not save if Stamina Mode is active. The issue has apparently been known for a month, but sadly still isn't fixed.",1
workout.progression.lite,A Google user,"Having tried several similar apps, this is by far the best. A nice addition could be for a notification to come and tell you when you have made 'progression' and done a new personal best.... Can you please make a version that can be used on the Samsung gear s3 watch. There is nothing anywhere near as good on that app store at the moment. Thanks",5
workout.progression.lite,A Google user,Great app! It can be even better with a larger catalogue of exercises with visuals included 😊,5
workout.progression.lite,A Google user,"Great app, but it lacks some in logging cardio exercises. If a setting for custom workouts was added where weight could be changed to distance and time to minutes (or minutes and seconds), I think that would be a great improvement.",4
workout.progression.lite,A Google user,"Has everything that I love from the other fitness apps that I've used in the past all rolled into one. Simple to learn, visually well done app. Wish I would've found it sooner. While it is a 5 star app for me, I do agree with some of the other reviewers in that visually it would be nicer to see symbols of the body parts. Also there are some exercises that have incorrect pictures depicting how to do them. It'd be nice to be able to change the pictures as well as some of the descriptions.",5
workout.progression.lite,A Google user,"Tried most of the gym apps and they all fell short, this one ticked all the boxes. This is a well thought out app. Great work developer 😌",5
workout.progression.lite,A Google user,"Awesome, simple where it needs to be and complex where it needs to be, Google fit integration is awesome, as well as the Android wear support.",5
workout.progression.lite,A Google user,"Sir Zoltan, i personally think this app is the best fitness progress tracker in play store. But one little major thing that decrease the app efficiency is that some descriptions and illustrations is either wrong or repetitive. For example, cable crossover with straight angle shows high to low illustration. Another is single arm dumbell press dictates hold one dumbbell with each hand. Please fix this sir Zoltan. And I will be planning to upgrade to pro version soon. Otherwise, it's still a 5-star rating for me.",5
workout.progression.lite,A Google user,"Amazing app, I really like the design",5
workout.progression.lite,A Google user,Fantastic UI! I purchased a moto 360 sport to help track my fitness. This app turns your android wear into the perfect weight lifting companion.  the phone app is very intuitive and uses material design perfectly.  I hope your app keeps updating and rolling out out new features. I have a few suggestions and personal requests for the app where is the best place to request these?,5
workout.progression.lite,A Google user,Great app for tracking workouts. Love the ability to see past exercises on next workout. Is it possible to modify the countdown timer to add the ability to enter the timer countdown using the keyboard rather than having to rotate the indicator on the dial?,4
workout.progression.lite,A Google user,"Great app. Lots of exercises, good little art on many showing how they can be done, as well as descriptions, and links to YouTube videos. The material design makes the UI flawless and beautiful. Great summary/statistics. Just overall the best workout tracking app I've used.",5
workout.progression.lite,A Google user,Beautiful and functional app. Bravo!,5
workout.progression.lite,A Google user,"best progression logger out there. before this i was stagnant for like a year, in a few months I've made 2 years worth of gains.",5
workout.progression.lite,A Google user,💩 don't see how it makes me a winner at the gym or even in life,1
workout.progression.lite,A Google user,"This is a great app.  Many built in schedules and exercises, but also the ability to create your own.  The only thing that might make it better would be a web interface that would allow for creating/managing workouts.",4
workout.progression.lite,A Google user,This is the best application for tracking any weight lifting based routine. I am at over 250 workouts with it and cannot recommend it enough.,5
workout.progression.lite,A Google user,Intuitive interface. Packed with features. You have to measure to progress!,5
workout.progression.lite,A Google user,I love the simplicity of use but at the same time the complex statistic analysis. Syncs with googlefit and backs up everything on the cloud.,5
workout.progression.lite,A Google user,"Great weightlifting App, but would love to see more options for exporting data. E.g.: Being able to export deadlift progression over time.",4
workout.progression.lite,A Google user,Won't let me finish a workout and keeps notifying me i have a workout in progress.        Edit: Battery saver stops the save from appearing. Other than that a fantastic app.,5
workout.progression.lite,A Google user,"I have downloaded and tried many, many of the workout logs and fitness apps and could not find one that would allow me to schedule my own workouts to my calender, also this allows you to do supersets and has programs to follow that are very helpful. Sorry no videos just pics, but If you know how to do the exercise with proper form it's very it's easy to follow. There is a timer for rest periods. Many apps had similar functions but lacked in one area or another. Definitely recommend this app.",5
workout.progression.lite,A Google user,"Love this app. Two things though: it seems to sync with Fit only after a workout is completed. Since I don't have service in my gym, the sync fails and the only way to sync later is to log out and log back in. Wish there was a manual sync or a way to set automatic syncing every x hours. Also, wish there was a way to prevent Android wear screen from turning off. When doing any timed exercise, it's so frustrating when the screen turns off and you can't see the clock",4
workout.progression.lite,A Google user,I would give 5 if my completed workouts would save and not stay stuck in resume after completing. I have to delete them due to no other alternative to the issue.,1
workout.progression.lite,A Google user,Great app with an up to date material design. Allows much for fine control over your rep/set planning than any other app I've used.,5
workout.progression.lite,A Google user,"To receive 5 stars the only thing missing is the recommended number of reps in Android Wear. If I say that an exercise should have 6-8 reps, it would be nice to be able to see this info on my watch. Please do this and I'll gladly give you 5 stars! Your program is perfect!",4
workout.progression.lite,A Google user,"nice little app to use with my moto sport 360 when Im weight lifting instead of cardio. One suggestion would be a companion windows sync to build routines and customs exercises. Doing it on the phone can be a bit cumbersome. Ive found the file in the apps folder that has the info but it seems to create a key for each exercise entered and of course that cant be generated. I was thinking of installing it on my tablet, using my keyboard to build up my routines and exercises and then re export the file to my phone.",4
workout.progression.lite,A Google user,"Very useful for lifting at the gym. I love the Google fit connectivity, it makes tracking everything really easy. This app probably has hundreds mabye thousands of exercises, unfortunately I have to add my own frequently.",5
workout.progression.lite,A Google user,"Love how the app lays out and functions, however my workouts keep syncing back to the originals I created and I lose all my edits. Tried backing up and importing and that worked. Make sure you back up after edits. Otherwise this is a 10/10.",4
workout.progression.lite,A Google user,"This app has a great selection of programs and exercises, plus it's dead simple to use. Stats and sync are great features. But please: change that tag line on the play store. It's terrible!",5
workout.progression.lite,A Google user,"This is hands down the best gym app. It is everything that I ever wanted. Jfit is nothing. My main problem is losing data, I lost my data once because of an update which got me pretty pissed off. I started using Google drive sync so that I won't lose it again. This time I wiped my phone and when I synced Google drive it got my data from a month ago, a whole month of data gone. One last thing; why does the timer sometimes stop working, it made me reinstall the app many times to get it to work back again.",3
workout.progression.lite,A Google user,I use this app several times a week and I love that I am able to set up workouts for home and the gym. It has definitely helped with my weight loss goals!,5
workout.progression.lite,A Google user,"Great selection of workout schedules, Google Fit integration for caloric burn and weight tracking syncing, just what I was looking for!  I would love if custom schedules could be backed up to Google Drive as well. Also, it would be very convenient if a set could be marked as complete on the Android Wear device.",5
workout.progression.lite,A Google user,"Without a doubt, the best weightlifting tracking app I've ever used ... and I've used a few. As a trainer, this is the first thing I recommend my clients download. Its the most intuitive way to keep track of your workouts, and it's so easy to use!",5
workout.progression.lite,A Google user,"Beautiful, clean, and functional!",5
workout.progression.lite,A Google user,"This app is great, I just wish there was a larger selection in muscles to choose from such as quads and hamstrings instead of just legs, etc.",5
workout.progression.lite,A Google user,Bought the app. Not different from the demo.. Complicated to use,1
workout.progression.lite,A Google user,"Great app, would like to share programs with friends",4
workout.progression.lite,A Google user,"This app is just perfect. Create your workouts and exercises, timed or for weight exercise tracking. It allows for really easy inputs that flows with your workout. The rest timer is wicked. Take in account the analysis tracking and all the other features, i happy paid $10. Cheers guys",5
workout.progression.lite,A Google user,Have bought pro version and worked great. but recently i change phone and Cant re - install it the app requests me to pay again,1
workout.progression.lite,A Google user,"I really like how there is actually a lifting app that syncs with google fit and my withings wifi scale, however there can be some improvements More workout plans would be nice! Maybe users could share workouts with each other or make them public for others to use. Can workouts in the history be added to a current plan after the work out is completed?",4
workout.progression.lite,A Google user,"Does exactly what you'd expect an app like this to do, plus very easy to use",5
workout.progression.lite,A Google user,"Edit: Bummed out the sync with drive isn't automatic. Forgot to export before wiping my phone. Gg 2 months of data. Previous: I hated jefit, stronglifts is only one program and fitness tracker was too complicated. Thankfully found progression. It's simple to use and fully customizable. UI could be more intuitive as it took a bit of figuring out.",4
workout.progression.lite,A Google user,"As good as a fitness log app can be, kudos.",5
workout.progression.lite,A Google user,Tried to download all images for exercises all of the exercises don't have images,3
workout.progression.lite,A Google user,"no need to look anywhere else. I've tried a bunch of the mainstream apps, i liked them but progression is by far the best. Dev also replies to emails personally.",5
workout.progression.lite,A Google user,"I was looking for something to replace the guided workouts I used to use on an Microsoft Band 2 now that I switched to an Android Wear device.  This app does a pretty good job replacing that, telling you what exercise to do, timing your rest, and letting you develop your own workout plan.",5
workout.progression.lite,A Google user,Keeps me motivated,5
workout.progression.lite,A Google user,Its probably the best app for tracking exercises. Could you add kg for specific exercises though? Deadlifts have to be in kg for me and everything else needs to be in pounds,4
workout.progression.lite,A Google user,The app takes a long time to update,5
workout.progression.lite,A Google user,"Was using fitnotes which is very good in its own right, but Progression is far and away the best fitness tracker in terms of UI and polish. Wear support is just icing on the cake! Developer also responds quickly to feedback. Excited to see this app evolve. I don't even need the premium features but I have no issues spending money to support talented devs like Zoltan. Also shout out to reddit where I first saw this app mentioned in the comments.",5
workout.progression.lite,A Google user,Great app. I use it daily at the gym.  Suggestion: feature to export and import workout schedules to and from other users perhaps?,5
workout.progression.lite,A Google user,Use it daily. It has features I didn't know I wanted. Everything just works!,5
workout.progression.lite,A Google user,"Really good app, has almost everything I would want. However, I'd like the ability to add the same exercise to two different groups of supersets if possible.",5
workout.progression.lite,A Google user,"Also last update deleted my schedule, for everyone who has this problem your workout days are in history. Overall very good app! Please fix this!",5
workout.progression.lite,A Google user,But is there a way to add an exercise multiple times per workout? I have the pro version.,4
workout.progression.lite,A Google user,A really easy to use and powerful tool. Took a bit to get used to navigating but once setup couldn't be easier. It's ad free which is really refreshing,5
workout.progression.lite,A Google user,"Great app, but unfortunately I updated the app and my schedule was deleted. Again. It's in the history, so I can at least continue my schedule today by repeating days through the history, but not sure I want to go through setting up my schedule in this app again vs just looking for an alternative. It's not the first time it's happened.",2
workout.progression.lite,A Google user,"That really annoying that my local exercise plans now are gone. Edit: seems like the app imported my Google Drive backup and wrote on top on my local changes, so my local stuff (which I hadn't backed up) is now lost 😨",2
workout.progression.lite,A Google user,Perfect fitness app graphical accurate a bit clunky here and there but still perfect.,5
workout.progression.lite,A Google user,"This app is exactly what I wanted.   It's straightforward to use.  It has a clean and simple interface.  It has go descriptions of the exercises and links to YouTube videos demonstrating the exercises.  This is the no frills workout app that I've been looking for.  Best of all, it takes very little space in my smartphone's memory.",5
workout.progression.lite,A Google user,"Awesome app, Android Wear integration is working again, my main reason for owning the sony smartwatch 3.",5
workout.progression.lite,A Google user,"The notification at the end of the rest time is being played through the phone speaker even in silence mode.  EDIT: unfortunately I am having the same problem yet and I found another bug. When not doing the exercises following the default order (and for instance you start with the last one from that day), after ending the last set of the exercise, it is displaying ""Complete workout"" instead of ""Next exercise"" option.",4
workout.progression.lite,A Google user,"Clean minimal UI, easy to use and has great features as well. Been looking for an app like this for ages. Thanks developer!",5
workout.progression.lite,A Google user,"This is a great app that has consolidated quite a few of my other fitness apps into one. One minor request though: would it be at all possible to add a per-set weight setting? As in, a weight option to go alongside 'min/max reps' when adding sets. Great app, otherwise!",5
workout.progression.lite,A Google user,"With progressive overload being the key pillar to gaining strength/muscle, this app is extremely useful to me. Great interface: Minimalist, clean, well designed and stable. Using it for every workout to track progress.",5
workout.progression.lite,A Google user,"Needs integration with Pebble and-or Garmin, and this would be the perfect App.  The best and easiest weight training app I've found. It's easy to set up a workout and even change on the fly for a session. Could use a warm up section as part of each exercise.",5
workout.progression.lite,A Google user,This app is worth the purchase! It has the best inbuilt apps and one can create/edit their own workouts and even set plate loading and timers! Very helpful!,5
workout.progression.lite,A Google user,"I've tried a few workout trackers in the past, but this is the best! Very clean UI, easy to use and simple to change things around.",5
workout.progression.lite,A Google user,"Same issue for me. I like the app a lot,  but it took me a while to enter my individual workout schedule and the next time I wanted to access it in the gym it was erased.",4
workout.progression.lite,A Google user,Great app. I upgraded to pro version as it gives you way more insight and statistics to track your progress.,5
